<?xml version="1.0" encoding="UTF-8"?>
<family xmlns:xsi= "http://www.w3.org/2001/XMLSchema-instance"
xsi:noNamespaceSchemaLocation="family.xsd">

<member>
<relationship>Father</relationship>
<name>A.K.Bansal</name>
<age>44</age>
<dob>12-12-1984</dob>
<accomodation-type></accomodation-type>
<photo src=""/>
<country> USA
<city>Meerut</city>
</country>  
<hasVisa>1</hasVisa>
</member>

<member>
<relationship>Mother</relationship>
<name>K.Bansal</name>
<age>60</age>
<dob>23-11-1984</dob>
<accomodation-type>Flat</accomodation-type>
<photo src=""/>
<country> India
<state>UP</state>
</country>
<hasVisa>0</hasVisa>
</member>
</family>

